{
  "schema_version": 1,
  "event_id": "c3d4e5f6-a7b8-4c9d-9e0f-1a2b3c4d5e6f",
  "event_type": "promoted",
  "tenant_id": "t_acme9k2l1mn4",
  "source_id": "shopify_pos_v2",
  "mapping_version_id": 8,
  "status": "active",
  "previous_status": "staged",
  "previous_active_version_id": 7,
  "changed_by": "u_ops_amit",
  "changed_ts": "2026-05-27T17:42:15.000Z"
}
